{
  "$schema": "https://json-schema.org/draft/2020-12/schema",
  "title": "STD downstream scope 1.0.0",
  "type": "object",
  "additionalProperties": false,
  "required": ["schema_version", "version", "revision", "participants", "members"],
  "properties": {
    "schema_version": {"const": "1.0.0"},
    "version": {"type": "string", "minLength": 1},
    "revision": {"type": ["string", "integer"], "minLength": 1},
    "participants": {
      "type": "array", "minItems": 1,
      "items": {
        "type": "object", "additionalProperties": false,
        "required": ["id", "role", "module", "backend"],
        "properties": {
          "id": {"type": "string", "minLength": 1},
          "role": {"enum": ["provider", "consumer"]},
          "module": {"type": "string", "minLength": 1},
          "backend": {"type": "string", "minLength": 1}
        }
      }
    },
    "members": {
      "type": "object", "minProperties": 1,
      "propertyNames": {"pattern": "^[A-Za-z0-9._/-]+#[A-Za-z0-9._-]+$"},
      "additionalProperties": {
        "type": "object", "additionalProperties": false,
        "required": ["required", "not_applicable"],
        "properties": {
          "required": {"type": "array", "uniqueItems": true, "items": {"type": "string", "minLength": 1}},
          "not_applicable": {
            "type": "array",
            "items": {
              "type": "object", "additionalProperties": false,
              "required": ["participant", "reason"],
              "properties": {
                "participant": {"type": "string", "minLength": 1},
                "reason": {"type": "string", "pattern": "\\S"}
              }
            }
          }
        }
      }
    }
  }
}
